{
  "manifest_version": "1.0.0-draft",
  "document_kind": "generation.manifest",
  "generation_id": "55555555-5555-7555-8555-555555555555",
  "created_at": "2029-12-31T23:58:00.000Z",
  "identity": {
    "org_uuid": "11111111-1111-7111-8111-111111111111",
    "video_uuid": "22222222-2222-7222-8222-222222222222",
    "source_id": "66666666-6666-7666-8666-666666666666",
    "attempt_id": "33333333-3333-7333-8333-333333333333",
    "dispatch_id": "44444444-4444-7444-8444-444444444444",
    "execution_id": "55555555-5555-7555-8555-555555555555"
  },
  "profile": {
    "id": "test-h264-sdr",
    "version": 1,
    "sha256": "abababababababababababababababababababababababababababababababab"
  },
  "encryption": {
    "mode": "none"
  },
  "media": {
    "duration_ms": 12000,
    "max_width": 1280,
    "max_height": 720,
    "has_audio": false,
    "rendition_count": 3
  },
  "renditions": [
    {
      "name": "720p",
      "width": 1280,
      "height": 720,
      "bandwidth_bps": 2800000,
      "average_bandwidth_bps": 2400000,
      "codecs": "avc1.64001f",
      "playlist_path": "720p/playlist.m3u8"
    },
    {
      "name": "480p",
      "width": 854,
      "height": 480,
      "bandwidth_bps": 1400000,
      "average_bandwidth_bps": 1200000,
      "codecs": "avc1.64001f",
      "playlist_path": "480p/playlist.m3u8"
    },
    {
      "name": "360p",
      "width": 640,
      "height": 360,
      "bandwidth_bps": 800000,
      "average_bandwidth_bps": 700000,
      "codecs": "avc1.64001f",
      "playlist_path": "360p/playlist.m3u8"
    }
  ],
  "master_playlist_path": "master.m3u8",
  "thumbnail_path": null,
  "artifact_count": 10,
  "total_bytes": 6351664,
  "artifacts": [
    {
      "path": "master.m3u8",
      "kind": "hls_master_playlist",
      "size_bytes": 512,
      "sha256": "0000000000000000000000000000000000000000000000000000000000000000"
    },
    {
      "path": "720p/playlist.m3u8",
      "kind": "hls_media_playlist",
      "size_bytes": 384,
      "sha256": "1111111111111111111111111111111111111111111111111111111111111111",
      "rendition": "720p"
    },
    {
      "path": "720p/segment_000.ts",
      "kind": "hls_segment",
      "size_bytes": 2000000,
      "sha256": "2222222222222222222222222222222222222222222222222222222222222222",
      "rendition": "720p"
    },
    {
      "path": "720p/segment_001.ts",
      "kind": "hls_segment",
      "size_bytes": 1500000,
      "sha256": "3333333333333333333333333333333333333333333333333333333333333333",
      "rendition": "720p"
    },
    {
      "path": "480p/playlist.m3u8",
      "kind": "hls_media_playlist",
      "size_bytes": 384,
      "sha256": "4444444444444444444444444444444444444444444444444444444444444444",
      "rendition": "480p"
    },
    {
      "path": "480p/segment_000.ts",
      "kind": "hls_segment",
      "size_bytes": 1000000,
      "sha256": "5555555555555555555555555555555555555555555555555555555555555555",
      "rendition": "480p"
    },
    {
      "path": "480p/segment_001.ts",
      "kind": "hls_segment",
      "size_bytes": 800000,
      "sha256": "6666666666666666666666666666666666666666666666666666666666666666",
      "rendition": "480p"
    },
    {
      "path": "360p/playlist.m3u8",
      "kind": "hls_media_playlist",
      "size_bytes": 384,
      "sha256": "7777777777777777777777777777777777777777777777777777777777777777",
      "rendition": "360p"
    },
    {
      "path": "360p/segment_000.ts",
      "kind": "hls_segment",
      "size_bytes": 600000,
      "sha256": "8888888888888888888888888888888888888888888888888888888888888888",
      "rendition": "360p"
    },
    {
      "path": "360p/segment_001.ts",
      "kind": "hls_segment",
      "size_bytes": 450000,
      "sha256": "9999999999999999999999999999999999999999999999999999999999999999",
      "rendition": "360p"
    }
  ],
  "diagnostics": [
    {
      "code": "thumbnail_unavailable",
      "detail": "No frame could be extracted for the thumbnail."
    }
  ]
}
